{
  "contract_version": "B-0.1",
  "ticket_id": "票01-不误报-容差与OCR噪声",
  "generated_by": "compare-engine-v0.1",
  "groups": [
    {
      "group_key": "SYNU1234567",
      "group_key_type": "container_no",
      "docs": [
        {
          "file": "bill_of_lading.json",
          "doc_type": "bill_of_lading"
        },
        {
          "file": "commercial_invoice.json",
          "doc_type": "commercial_invoice"
        },
        {
          "file": "customs_declaration.json",
          "doc_type": "customs_declaration"
        }
      ]
    }
  ],
  "diffs": [],
  "not_comparable": [
    {
      "id": "X001",
      "category": "not_comparable",
      "field": "装货港",
      "semantic_key": "装货港",
      "level": "orange",
      "verdict": "not_comparable",
      "left": {
        "source": "bill_of_lading.json",
        "doc_type": "bill_of_lading",
        "path": "fields.port_of_loading",
        "value": "SHANGHAI",
        "confidence": 1.0,
        "raw_span": {
          "page": 1,
          "text": "PORT OF LOADING: SHANGHAI"
        },
        "normalized": true,
        "extracted": false
      },
      "right": {
        "source": "customs_declaration.json",
        "doc_type": "customs_declaration",
        "path": "fields.port_of_dispatch",
        "value": "57078",
        "confidence": 0.5,
        "raw_span": {
          "page": 1,
          "text": "19. Foreign Port of Lading: 57078"
        },
        "normalized": false,
        "extracted": false
      },
      "message": "装货港不可比：bill_of_lading 存地名「SHANGHAI」，customs_declaration 存代码「57078」；按映射表 §5.1 规则 2 判不可比，不判不一致",
      "rule_id": "CMP-PORT-NC",
      "reason": "code-vs-name",
      "suggest_action": "港口一码一名，无法直接比对；如需硬判请查 HTS Annex C"
    },
    {
      "id": "X002",
      "category": "not_comparable",
      "field": "卸货港",
      "semantic_key": "卸货港",
      "level": "orange",
      "verdict": "not_comparable",
      "left": {
        "source": "bill_of_lading.json",
        "doc_type": "bill_of_lading",
        "path": "fields.port_of_discharge",
        "value": "LOS ANGELES",
        "confidence": 1.0,
        "raw_span": {
          "page": 1,
          "text": "PORT OF DISCHARGE: LOS ANGELES"
        },
        "normalized": true,
        "extracted": false
      },
      "right": {
        "source": "customs_declaration.json",
        "doc_type": "customs_declaration",
        "path": "fields.port_of_destination",
        "value": "2704",
        "confidence": 0.5,
        "raw_span": {
          "page": 1,
          "text": "20. U.S. Port of Unlading: 2704"
        },
        "normalized": false,
        "extracted": false
      },
      "message": "卸货港不可比：bill_of_lading 存地名「LOS ANGELES」，customs_declaration 存代码「2704」；按映射表 §5.1 规则 2 判不可比，不判不一致",
      "rule_id": "CMP-PORT-NC",
      "reason": "code-vs-name",
      "suggest_action": "港口一码一名，无法直接比对；如需硬判请查 HTS Annex C"
    },
    {
      "id": "X003",
      "category": "not_comparable",
      "field": "装货港",
      "semantic_key": "装货港",
      "level": "orange",
      "verdict": "not_comparable",
      "left": {
        "source": "commercial_invoice.json",
        "doc_type": "commercial_invoice",
        "path": "fields.port_of_loading",
        "value": "SHANGHAI",
        "confidence": 0.95,
        "raw_span": {
          "page": 1,
          "text": "Loading Port: SHANGHAI"
        },
        "normalized": true,
        "extracted": false
      },
      "right": {
        "source": "customs_declaration.json",
        "doc_type": "customs_declaration",
        "path": "fields.port_of_dispatch",
        "value": "57078",
        "confidence": 0.5,
        "raw_span": {
          "page": 1,
          "text": "19. Foreign Port of Lading: 57078"
        },
        "normalized": false,
        "extracted": false
      },
      "message": "装货港不可比：commercial_invoice 存地名「SHANGHAI」，customs_declaration 存代码「57078」；按映射表 §5.1 规则 2 判不可比，不判不一致",
      "rule_id": "CMP-PORT-NC",
      "reason": "code-vs-name",
      "suggest_action": "港口一码一名，无法直接比对；如需硬判请查 HTS Annex C"
    },
    {
      "id": "X004",
      "category": "not_comparable",
      "field": "卸货港",
      "semantic_key": "卸货港",
      "level": "orange",
      "verdict": "not_comparable",
      "left": {
        "source": "commercial_invoice.json",
        "doc_type": "commercial_invoice",
        "path": "fields.port_of_discharge",
        "value": "LOS ANGELES",
        "confidence": 0.95,
        "raw_span": {
          "page": 1,
          "text": "Discharge Port: LOS ANGELES"
        },
        "normalized": true,
        "extracted": false
      },
      "right": {
        "source": "customs_declaration.json",
        "doc_type": "customs_declaration",
        "path": "fields.port_of_destination",
        "value": "2704",
        "confidence": 0.5,
        "raw_span": {
          "page": 1,
          "text": "20. U.S. Port of Unlading: 2704"
        },
        "normalized": false,
        "extracted": false
      },
      "message": "卸货港不可比：commercial_invoice 存地名「LOS ANGELES」，customs_declaration 存代码「2704」；按映射表 §5.1 规则 2 判不可比，不判不一致",
      "rule_id": "CMP-PORT-NC",
      "reason": "code-vs-name",
      "suggest_action": "港口一码一名，无法直接比对；如需硬判请查 HTS Annex C"
    }
  ],
  "notes": [
    {
      "id": "N001",
      "category": "note",
      "field": "提单号",
      "semantic_key": "提单号",
      "verdict": "fuzzy_match",
      "left": {
        "source": "bill_of_lading.json",
        "doc_type": "bill_of_lading",
        "path": "fields.bl_no",
        "value": "MAEU92ZKVJM35",
        "confidence": 1.0,
        "raw_span": {
          "page": 1,
          "text": "B/L NO. MAEU92ZKVJM35"
        },
        "normalized": true,
        "extracted": false
      },
      "right": {
        "source": "customs_declaration.json",
        "doc_type": "customs_declaration",
        "path": "parse_meta.warnings[regex:bl_no]",
        "value": "MAEU SZHVJM535",
        "confidence": 0.6,
        "raw_span": {
          "page": 1,
          "text": "MAEU SZHVJM535"
        },
        "normalized": false,
        "extracted": true
      },
      "message": "提单号模糊匹配命中：bill_of_lading=「MAEU92ZKVJM35」 ↔ customs_declaration=「MAEU SZHVJM535」（ratio=0.769 ≥ 0.7），判为 OCR 噪声不告警",
      "rule_id": "CMP-ID-BL"
    },
    {
      "id": "N002",
      "category": "note",
      "field": "金额",
      "semantic_key": "金额",
      "verdict": "within_tolerance",
      "left": {
        "source": "commercial_invoice.json",
        "doc_type": "commercial_invoice",
        "path": "fields.total_value.amount",
        "value": 26762.4,
        "confidence": 0.95,
        "raw_span": {
          "page": 1,
          "text": "Total Amount: US$26,762.40"
        },
        "normalized": true,
        "extracted": false
      },
      "right": {
        "source": "customs_declaration.json",
        "doc_type": "customs_declaration",
        "path": "fields.total_value.amount",
        "value": 26762.0,
        "confidence": 0.95,
        "raw_span": {
          "page": 1,
          "text": "39. Total Entered Value: $26,762.00"
        },
        "normalized": true,
        "extracted": false
      },
      "message": "金额容差内差异：commercial_invoice=26762.4 ↔ customs_declaration=26762（|Δ|=0.4, rel=0.0015%，在阈值内不告警）",
      "rule_id": "CMP-NUM-AMOUNT",
      "deviation": {
        "abs": 0.4000000000014552,
        "rel": 1.5e-05
      }
    }
  ],
  "alerts": [
    {
      "category": "compliance_alert",
      "rule_id": "R-002",
      "level": "orange",
      "message": "归类须依《归类总规则》(GRI) 及相应类注、章注确定，建议复核本票所涉章节是否存在排除条款",
      "basis": "C-USITC-GRI-归类总规则.pdf",
      "url": "https://hts.usitc.gov/reststop/file?release=currentRelease&filename=General%20Rules%20of%20Interpretation",
      "trigger": {
        "hs_code": [
          "4820100000"
        ],
        "matched_scope": "全部 HS"
      },
      "id": "A001"
    }
  ],
  "skipped": [
    {
      "id": "S001",
      "field": "consignee",
      "source": "bill_of_lading.json",
      "reason": "提单为指示抬头「TO ORDER」，属国际贸易标准写法；已改用 notify_party 旁证比对买方链",
      "policy": "POL-TO-ORDER"
    }
  ],
  "summary": {
    "checked_fields": 23,
    "diffs": {
      "red": 0,
      "yellow": 0,
      "orange": 0
    },
    "not_comparable": 4,
    "notes": 2,
    "alerts": 1,
    "skipped": 1
  }
}